{
  "schemaVersion": 1,
  "id": "src_000051",
  "title": "Historic Sanctuary of Machu Picchu",
  "creator": "UNESCO World Heritage Centre",
  "publisher": "UNESCO World Heritage Centre",
  "sourceType": "institutional",
  "publicationDate": "See source page; not consistently supplied",
  "url": "https://whc.unesco.org/en/list/274/",
  "accessedAt": "2026-09-26",
  "sourceFamily": "unesco",
  "language": "English",
  "rights": "Linked institutional source; original summaries, no reproduced images. Source retains its own rights.",
  "inspectionNote": "Relevant passage inspected during this build: Description and Outstanding Universal Value / Brief synthesis. This is an evidence check, not an independent historical peer review."
}
