{
  "schemaVersion": 1,
  "id": "src_000074",
  "title": "Charter of the United Nations",
  "creator": "United Nations Treaty Collection",
  "publisher": "United Nations Treaty Collection",
  "sourceType": "archive",
  "publicationDate": "See source page; not consistently supplied",
  "url": "https://treaties.un.org/Pages/ViewDetails.aspx?chapter=1&mtdsg_no=I-1&src=TREATY",
  "accessedAt": "2026-09-26",
  "sourceFamily": "un",
  "language": "English",
  "rights": "Linked institutional source; original summaries, no reproduced images. Source retains its own rights.",
  "inspectionNote": "Relevant passage inspected during this build: Chapter I.1; San Francisco 26 June 1945; entry into force. This is an evidence check, not an independent historical peer review."
}
