{
  "schemaVersion": 1,
  "id": "src_000073",
  "title": "The birth of the Web",
  "creator": "CERN",
  "publisher": "CERN",
  "sourceType": "institutional",
  "publicationDate": "See source page; not consistently supplied",
  "url": "https://home.cern/science/computing/the-birth-of-the-web/",
  "accessedAt": "2026-09-26",
  "sourceFamily": "cern",
  "language": "English",
  "rights": "Linked institutional source; original summaries, no reproduced images. Source retains its own rights.",
  "inspectionNote": "Relevant passage inspected during this build: 1989 invention; 30 April 1993 public-domain release. This is an evidence check, not an independent historical peer review."
}
