{
  "schemaVersion": 1,
  "id": "src_000137",
  "title": "IGY History",
  "creator": "NOAA Global Monitoring Laboratory",
  "publisher": "NOAA Global Monitoring Laboratory",
  "sourceType": "institutional",
  "publicationDate": "Not stated",
  "url": "https://gml.noaa.gov/obop/spo/igy_history.html",
  "accessedAt": "2026-09-27",
  "sourceFamily": "noaa",
  "language": "English",
  "rights": "Linked source; original summary, no reproduced images. Source retains its own rights.",
  "inspectionNote": "Inspected Opening paragraphs: July 1957–December 1958 and coordinated global geophysical observations on 2026-09-27; citation scope is limited to the passages identified in the linked record."
}
