{
  "schemaVersion": 1,
  "id": "src_000102",
  "title": "Plaque with Warrior and Attendants",
  "creator": "The Metropolitan Museum of Art",
  "publisher": "The Metropolitan Museum of Art",
  "sourceType": "museum",
  "publicationDate": "Not stated",
  "url": "https://www.metmuseum.org/art/collection/search/316393",
  "accessedAt": "2026-09-27",
  "sourceFamily": "met",
  "language": "English",
  "rights": "Linked source; original summary, no reproduced images. Source retains its own rights.",
  "inspectionNote": "Inspected Object 1990.332; palace plaques in the sixteenth and seventeenth centuries; scale and rank on 2026-09-27; citation scope is limited to the passages identified in the linked record."
}
