{
  "schemaVersion": 1,
  "id": "src_000062",
  "title": "Chaco Culture",
  "creator": "US National Park Service",
  "publisher": "US National Park Service",
  "sourceType": "institutional",
  "publicationDate": "See source page; not consistently supplied",
  "url": "https://home.nps.gov/articles/chaco.htm",
  "accessedAt": "2026-09-26",
  "sourceFamily": "nps",
  "language": "English",
  "rights": "Linked institutional source; original summaries, no reproduced images. Source retains its own rights.",
  "inspectionNote": "Relevant passage inspected during this build: Great houses, approximately 850–1250. This is an evidence check, not an independent historical peer review."
}
