{
  "schemaVersion": 1,
  "id": "src_000063",
  "title": "Uruk: The First City",
  "creator": "Metropolitan Museum of Art",
  "publisher": "Metropolitan Museum of Art",
  "sourceType": "museum",
  "publicationDate": "See source page; not consistently supplied",
  "url": "https://www.metmuseum.org/essays/uruk-the-first-city",
  "accessedAt": "2026-09-26",
  "sourceFamily": "met",
  "language": "English",
  "rights": "Linked institutional source; original summaries, no reproduced images. Source retains its own rights.",
  "inspectionNote": "Relevant passage inspected during this build: Urban development around 3200 BCE. This is an evidence check, not an independent historical peer review."
}
