{
  "schemaVersion": 1,
  "id": "src_000090",
  "title": "The Treaty in brief",
  "creator": "Manatū Taonga Ministry for Culture and Heritage",
  "publisher": "Manatū Taonga Ministry for Culture and Heritage",
  "sourceType": "institutional",
  "publicationDate": "See source page; not consistently supplied",
  "url": "https://nzhistory.govt.nz/politics/treaty/the-treaty-in-brief",
  "accessedAt": "2026-09-26",
  "sourceFamily": "nzhistory",
  "language": "English",
  "rights": "Linked institutional source; original summaries, no reproduced images. Source retains its own rights.",
  "inspectionNote": "Relevant passage inspected during this build: First signing on 6 February 1840; versions and subsequent signatures. This is an evidence check, not an independent historical peer review."
}
