{
  "schemaVersion": 1,
  "id": "src_000071",
  "title": "History of smallpox vaccination",
  "creator": "World Health Organization",
  "publisher": "World Health Organization",
  "sourceType": "institutional",
  "publicationDate": "See source page; not consistently supplied",
  "url": "https://www.who.int/news-room/spotlight/history-of-vaccination/history-of-smallpox-vaccination",
  "accessedAt": "2026-09-26",
  "sourceFamily": "who",
  "language": "English",
  "rights": "Linked institutional source; original summaries, no reproduced images. Source retains its own rights.",
  "inspectionNote": "Relevant passage inspected during this build: 1500s; 1721; 1796 timeline entries. This is an evidence check, not an independent historical peer review."
}
