{
  "schemaVersion": 1,
  "id": "src_000106",
  "title": "The Ardabil Carpet",
  "creator": "Victoria and Albert Museum",
  "publisher": "Victoria and Albert Museum",
  "sourceType": "museum",
  "publicationDate": "Updated 2026-09-24",
  "url": "https://www.vam.ac.uk/articles/the-ardabil-carpet/",
  "accessedAt": "2026-09-27",
  "sourceFamily": "vam",
  "language": "English",
  "rights": "Linked source; original summary, no reproduced images. Source retains its own rights.",
  "inspectionNote": "Inspected Dating, inscription and design sections; AH 946 and 1539–1540 CE on 2026-09-27; citation scope is limited to the passages identified in the linked record."
}
