{
  "schemaVersion": 1,
  "id": "src_000136",
  "title": "Birth of Impressionism Explored in Exhibition at Musée d’Orsay and National Gallery of Art, Washington",
  "creator": "National Gallery of Art, Washington",
  "publisher": "National Gallery of Art, Washington",
  "sourceType": "museum",
  "publicationDate": "2023-06-13; updated 2024-08-28",
  "url": "https://www.nga.gov/press/birth-impressionism-explored-exhibition-musee-dorsay-and-national-gallery-art-washington",
  "accessedAt": "2026-09-27",
  "sourceFamily": "nga-us",
  "language": "English",
  "rights": "Linked source; original summary, no reproduced images. Source retains its own rights.",
  "inspectionNote": "Inspected Opening paragraph: exhibition opened 15 April 1874 at Nadar’s studio on 2026-09-27; citation scope is limited to the passages identified in the linked record."
}
