{
  "schemaVersion": 1,
  "id": "src_000119",
  "title": "Moche Portrait-Head Vessels",
  "creator": "Joanne Pillsbury",
  "publisher": "The Metropolitan Museum of Art",
  "sourceType": "museum",
  "publicationDate": "2021-09-01",
  "url": "https://www.metmuseum.org/essays/moche-portrait-head-vessels",
  "accessedAt": "2026-09-27",
  "sourceFamily": "met",
  "language": "English",
  "rights": "Linked source; original summary, no reproduced images. Source retains its own rights.",
  "inspectionNote": "Inspected Moche III (ca. 300–450) and IV (ca. 450–550); molding, individual likeness and interpretive limits on 2026-09-27; citation scope is limited to the passages identified in the linked record."
}
