{
  "schemaVersion": 1,
  "id": "src_000117",
  "title": "Jar — Ban Chiang",
  "creator": "The Metropolitan Museum of Art",
  "publisher": "The Metropolitan Museum of Art",
  "sourceType": "museum",
  "publicationDate": "Not stated",
  "url": "https://www.metmuseum.org/art/collection/search/37408",
  "accessedAt": "2026-09-27",
  "sourceFamily": "met",
  "language": "English",
  "rights": "Linked source; original summary, no reproduced images. Source retains its own rights.",
  "inspectionNote": "Inspected Object 1987.424.9; Date, Medium and painted decoration; phase-label inconsistency retained on 2026-09-27; citation scope is limited to the passages identified in the linked record."
}
