{
  "schemaVersion": 1,
  "id": "src_000084",
  "title": "Museum highlights: Charles Darwin",
  "creator": "Natural History Museum, London",
  "publisher": "Natural History Museum, London",
  "sourceType": "museum",
  "publicationDate": "See source page; not consistently supplied",
  "url": "https://www.nhm.ac.uk/discover/museum-highlights-charles-darwin.html",
  "accessedAt": "2026-09-26",
  "sourceFamily": "nhm",
  "language": "English",
  "rights": "Linked institutional source; original summaries, no reproduced images. Source retains its own rights.",
  "inspectionNote": "Relevant passage inspected during this build: First edition of On the Origin of Species, 1859. This is an evidence check, not an independent historical peer review."
}
