{
  "schemaVersion": 1,
  "id": "src_000138",
  "title": "Thirty-six Views of Mount Fuji: The Great Wave off Kanagawa",
  "creator": "Tokyo Fuji Art Museum",
  "publisher": "Tokyo Fuji Art Museum",
  "sourceType": "museum",
  "publicationDate": "Not stated",
  "url": "https://www.fujibi.or.jp/en/collection/artwork/03628/",
  "accessedAt": "2026-09-27",
  "sourceFamily": "tokyo-fuji",
  "language": "English",
  "rights": "Linked source; original summary, no reproduced images. Source retains its own rights.",
  "inspectionNote": "Inspected Collection details: c. 1830–32 (Tenpo 1–3), color woodblock print on 2026-09-27; citation scope is limited to the passages identified in the linked record."
}
