{
  "schemaVersion": 1,
  "id": "src_000085",
  "title": "Oxford and the forgotten man of penicillin",
  "creator": "Science Museum Group",
  "publisher": "Science Museum Group",
  "sourceType": "museum",
  "publicationDate": "See source page; not consistently supplied",
  "url": "https://blog.sciencemuseum.org.uk/oxford-and-the-forgotten-man-of-penicillin/",
  "accessedAt": "2026-09-26",
  "sourceFamily": "smg",
  "language": "English",
  "rights": "Linked institutional source; original summaries, no reproduced images. Source retains its own rights.",
  "inspectionNote": "Relevant passage inspected during this build: Fleming in 1928; Oxford team and Albert Alexander in 1941. This is an evidence check, not an independent historical peer review."
}
