{
  "schemaVersion": 1,
  "id": "src_000091",
  "title": "Women’s suffrage: brief history",
  "creator": "Manatū Taonga Ministry for Culture and Heritage",
  "publisher": "Manatū Taonga Ministry for Culture and Heritage",
  "sourceType": "institutional",
  "publicationDate": "See source page; not consistently supplied",
  "url": "https://nzhistory.govt.nz/politics/womens-suffrage/brief-history",
  "accessedAt": "2026-09-26",
  "sourceFamily": "nzhistory",
  "language": "English",
  "rights": "Linked institutional source; original summaries, no reproduced images. Source retains its own rights.",
  "inspectionNote": "Relevant passage inspected during this build: Electoral Act signed 19 September 1893. This is an evidence check, not an independent historical peer review."
}
