{
  "schemaVersion": 1,
  "id": "src_000079",
  "title": "Emancipation Proclamation (1863)",
  "creator": "US National Archives",
  "publisher": "US National Archives",
  "sourceType": "archive",
  "publicationDate": "See source page; not consistently supplied",
  "url": "https://www.archives.gov/milestone-documents/emancipation-proclamation",
  "accessedAt": "2026-09-26",
  "sourceFamily": "nara",
  "language": "English",
  "rights": "Linked institutional source; original summaries, no reproduced images. Source retains its own rights.",
  "inspectionNote": "Relevant passage inspected during this build: 1 January 1863; specified areas in rebellion. This is an evidence check, not an independent historical peer review."
}
