{
  "schemaVersion": 1,
  "id": "src_000083",
  "title": "Declaration of the Rights of Man and of the Citizen",
  "creator": "Presidency of France",
  "publisher": "Presidency of France",
  "sourceType": "institutional",
  "publicationDate": "See source page; not consistently supplied",
  "url": "https://www.elysee.fr/en/french-presidency/the-declaration-of-the-rights-of-man-and-of-the-citizen",
  "accessedAt": "2026-09-26",
  "sourceFamily": "elysee",
  "language": "English",
  "rights": "Linked institutional source; original summaries, no reproduced images. Source retains its own rights.",
  "inspectionNote": "Relevant passage inspected during this build: Articles voted 20–26 August 1789. This is an evidence check, not an independent historical peer review."
}
