{
  "schemaVersion": 1,
  "id": "src_000078",
  "title": "Declaration of Independence (1776)",
  "creator": "US National Archives",
  "publisher": "US National Archives",
  "sourceType": "archive",
  "publicationDate": "See source page; not consistently supplied",
  "url": "https://www.archives.gov/milestone-documents/declaration-of-independence",
  "accessedAt": "2026-09-26",
  "sourceFamily": "nara",
  "language": "English",
  "rights": "Linked institutional source; original summaries, no reproduced images. Source retains its own rights.",
  "inspectionNote": "Relevant passage inspected during this build: Adoption and signing chronology. This is an evidence check, not an independent historical peer review."
}
