{
  "schemaVersion": 1,
  "id": "src_000113",
  "title": "Sogdian Trade",
  "creator": "Étienne de la Vaissière",
  "publisher": "Encyclopaedia Iranica",
  "sourceType": "scholarly",
  "publicationDate": "2004",
  "url": "https://www.iranicaonline.org/articles/sogdian-trade/",
  "accessedAt": "2026-09-27",
  "sourceFamily": "iranica",
  "language": "English",
  "rights": "Linked source; original summary, no reproduced images. Source retains its own rights.",
  "inspectionNote": "Inspected Origins section: Ancient Letters written in 313; Gansu and Samarkand on 2026-09-27; citation scope is limited to the passages identified in the linked record."
}
