{
  "schemaVersion": 1,
  "id": "src_000072",
  "title": "Commemorating smallpox eradication",
  "creator": "World Health Organization",
  "publisher": "World Health Organization",
  "sourceType": "institutional",
  "publicationDate": "See source page; not consistently supplied",
  "url": "https://www.who.int/news/item/08-05-2020-commemorating-smallpox-eradication-a-legacy-of-hope-for-covid-19-and-other-diseases",
  "accessedAt": "2026-09-26",
  "sourceFamily": "who",
  "language": "English",
  "rights": "Linked institutional source; original summaries, no reproduced images. Source retains its own rights.",
  "inspectionNote": "Relevant passage inspected during this build: 8 May 1980 declaration; intensified programme in 1967. This is an evidence check, not an independent historical peer review."
}
